{
  "contract_version": 1,
  "hardware_id": "hardware:pn532-read-lab",
  "version": 1,
  "display_name": "PN532 read-only candidate",
  "compatible_board_profiles": ["board-profile:cardputer-original-v1"],
  "bus": "i2c",
  "interaction_modes": ["read_only"],
  "activation_state": "disabled",
  "wiring_status": "unassigned",
  "pins": [],
  "driver_status": "not_integrated",
  "transmit_permitted": false,
  "write_permitted": false,
  "electrical_review_status": "pending",
  "tested_on_hardware": false
}
